tender_no,tender_description,agency,award_date,tender_detail_status,supplier_name,awarded_amt
AGC000ETT15000019,Invitation To Tender for the provision of offsite disaster Recovery facilities management and hosting services,Attorney-General's Chambers,21/4/2016,Awarded to Suppliers,NCS PTE. LTD.,232450.28
AGC000ETT15000020,"Invitation To Tender (ITT) for Supply, Delivery, Installation, Implementation and Maintenance of Asset Management System for AGC",Attorney-General's Chambers,6/4/2016,Awarded to Suppliers,RAPTECH PTE. LTD.,605489
AGC000ETT16000001,"INVITATION TO TENDER FOR THE SUPPLY, DELIVERY, INSTALLATION AND TESTING OF MOBILE WIFI ROUTER DEVICES AND MOBILE LINES WITH DATA PLAN SUBSCRIPTION",Attorney-General's Chambers,10/5/2016,Awarded to Suppliers,BTW Technology Pte Ltd,197064.3
AGC000ETT16000003,INVITATION TO TENDER FOR APPLICATION MAINTENANCE AND SUPPORT FOR ENTERPRISE LEGAL MANAGEMENT SYSTEM (ELMS) FOR ATTORNEY-GENERAL'S CHAMBERS,Attorney-General's Chambers,27/4/2016,Awarded to Suppliers,NOVACITYNETS PTE LTD,2640325
AGC000ETT16000004,"ITT FOR THE PROVISION OF APPLICATION MAINTENANCE AND SUPPORT FOR THE SPYDUS LIBRARY SYSTEM FOR THE ATTORNEY-GENERALS CHAMBER, THE SUPREME COURT AND THE STATE COURTS",Attorney-General's Chambers,16/9/2016,Awarded to Suppliers,CIVICA PTE. LTD.,395374
AGC000ETT16000005,INVITATION TO TENDER FOR THE PROVISION OF OFFSITE STORAGE FOR THE ATTORNEY-GENERAL'S CHAMBERS FOR A PERIOD OF TWO (2) YEARS WITH AN OPTION TO EXTEND FOR ONE (1) YEAR,Attorney-General's Chambers,15/9/2016,Awarded to No Suppliers,Unknown,0
AGC000ETT16000007,"To conduct security risk assessment, review existing security measures and develop security protection plan and security procedures for Attorney-General's Chambers.",Attorney-General's Chambers,29/9/2016,Awarded to Suppliers,JACOBS INTERNATIONAL CONSULTANTS PTE. LTD.,52400
AGC000ETT16000022,INVITATION TO TENDER FOR THE PROVISION OF TWO RUNS OF A 2-DAY WRITTEN ADVOCACY COURSE TO PARTICIPANTS FROM THE ATTORNEY-GENERALS CHAMBERS,Attorney-General's Chambers,1/12/2016,Awarded to Suppliers,ARMSTRONG TALENT DEVELOPMENT,74500
AVA000ETT15000037,TENDER FOR THE THREE-YEAR PERIOD CONTRACT FOR THE SUPPLY AND DELIVERY OF GASES FOR LAB USE AT AGRI- FOOD & VETERINARY AUTHORITY NO. 6 & 10 PERAHU ROAD (718827 & 718837),Agri-food and Veterinary Authority,20/4/2016,Awarded to Suppliers,AIR LIQUIDE SINGAPORE PRIVATE LIMITED,11325
AVA000ETT15000037,TENDER FOR THE THREE-YEAR PERIOD CONTRACT FOR THE SUPPLY AND DELIVERY OF GASES FOR LAB USE AT AGRI- FOOD & VETERINARY AUTHORITY NO. 6 & 10 PERAHU ROAD (718827 & 718837),Agri-food and Veterinary Authority,20/4/2016,Awarded to Suppliers,LEEDEN NATIONAL OXYGEN LTD.,83848.5
AVA000ETT15000037,TENDER FOR THE THREE-YEAR PERIOD CONTRACT FOR THE SUPPLY AND DELIVERY OF GASES FOR LAB USE AT AGRI- FOOD & VETERINARY AUTHORITY NO. 6 & 10 PERAHU ROAD (718827 & 718837),Agri-food and Veterinary Authority,20/4/2016,Awarded to Suppliers,VERSUM MATERIALS SINGAPORE PTE. LTD.,74969.5
AVA000ETT15000055,Tender for period contract for the supply of disposable columns for lab use for a period of two (2) years (where the 2nd year is optional),Agri-food and Veterinary Authority,6/4/2016,Awarded to Suppliers,FISHER SCIENTIFIC PTE LTD,438725
AVA000ETT15000062,Tender for a two-year period contract for the supply of single step listeria enrichment broth complete with antibiotics,Agri-food and Veterinary Authority,7/6/2016,Awarded to Suppliers,THERMO SCIENTIFIC MICROBIOLOGY PTE. LTD.,87200
AVA000ETT16000002,Tender for the Disposal of general waste at Lim Chu Kang (End) Jetty,Agri-food and Veterinary Authority,13/5/2016,Awarded to Suppliers,V8 ENVIRONMENTAL PTE LTD,184500
AVA000ETT16000003,"Tender for the Provision, Installation and Maintenance of Floating Cage System Off Pulau Tekong",Agri-food and Veterinary Authority,25/7/2016,Awarded to Suppliers,DATAWIN ENTERPRISES,709900
AVA000ETT16000005,"Supply, installation and commissioning of one (1) unit of liquid chromatograph-hyphenated quadrupole and high resolution mass spectrometer hybrid system",Agri-food and Veterinary Authority,22/11/2016,Awarded to Suppliers,THERMO FISHER SCIENTIFIC PTE. LTD.,626283.1
AVA000ETT16000007,Tender for provision of bus transportation services for a period of three (3) years,Agri-food and Veterinary Authority,6/6/2016,Awarded to Suppliers,COMFORTDELGRO BUS PTE. LTD.,18855
AVA000ETT16000008,"Tender for the Provision of Armed Security Guards at Senoko Fishery Port for a period of five years, where 4th and 5th years are optional",Agri-food and Veterinary Authority,29/7/2016,Awarded to Suppliers,CERTIS CISCO AUXILIARY POLICE FORCE PTE. LTD.,3262344
AVA000ETT16000009,Tender for Laboratory testing services for selected food safety tests (for period of six months with option to extend by another six months),Agri-food and Veterinary Authority,2/12/2016,Awarded to Suppliers,ALS TECHNICHEM (SINGAPORE) PTE LTD,54000
AVA000ETT16000009,Tender for Laboratory testing services for selected food safety tests (for period of six months with option to extend by another six months),Agri-food and Veterinary Authority,2/12/2016,Awarded to Suppliers,COVANCE (ASIA) PTE LTD,52000
AVA000ETT16000009,Tender for Laboratory testing services for selected food safety tests (for period of six months with option to extend by another six months),Agri-food and Veterinary Authority,2/12/2016,Awarded to Suppliers,Setsco Services Pte Ltd,73980
AVA000ETT16000009,Tender for Laboratory testing services for selected food safety tests (for period of six months with option to extend by another six months),Agri-food and Veterinary Authority,2/12/2016,Awarded to Suppliers,TUV SUD PSB PTE. LTD.,3000
AVA000ETT16000010,Tender for the venue rental and banqueting services for Agri-Food and Veterinary Authority's Food Safety Awards Night 2016,Agri-food and Veterinary Authority,26/5/2016,Awarded to Suppliers,MARINA BAY SANDS PTE. LTD.,66605
AVA000ETT16000011,"Tender for the Supply of labour, machinery, equipment, materials, and other logistics arrangements for the improvement works on drain covers and drains at Senoko Fishery Port's Market Area",Agri-food and Veterinary Authority,12/10/2016,Awarded to Suppliers,HBB ENGINEERING PTE. LTD.,100000
AVA000ETT16000012,"Tender for the Letting of Market Lot No. 1, 33, 49, 80 & 82 at Jurong Fishery Port for a term of three years",Agri-food and Veterinary Authority,8/7/2016,Awarded to Suppliers,SOON GUAN FISHERY CO,1750
AVA000ETT16000013,"Tender for the Letting of Market Lot No. 9, 29 and Ice Crusher Stall No. #01-02 at Senoko Fishery Port for a term of three years",Agri-food and Veterinary Authority,5/7/2016,Awarded to Suppliers,UNI-TAT ICE & MARKETING PTE LTD,3388
AVA000ETT16000014,Tender for two-year period contract for the supply and delivery of disposable centrifugal filtering devices for lab use at Agri-Food & Veterinary Authority No. 10 Perahu Road (S718837),Agri-food and Veterinary Authority,3/11/2016,Awarded to Suppliers,MERCK PTE. LTD.,262500
AVA000ETT16000015,Tender for AVA Data Centre System Maintenance,Agri-food and Veterinary Authority,30/6/2016,Awarded to Suppliers,DC-FM PTE. LTD.,685251.6
AVA000ETT16000016,Tender for two-year period contract for the supply and delivery of autosampler vials for lab use,Agri-food and Veterinary Authority,7/10/2016,Awarded to Suppliers,CHEMIKALIE PTE. LTD.,68796
AVA000ETT16000016,Tender for two-year period contract for the supply and delivery of autosampler vials for lab use,Agri-food and Veterinary Authority,7/10/2016,Awarded to Suppliers,FISHER SCIENTIFIC PTE LTD,7657.5
AVA000ETT16000019,"Tender for two-year period contract for sequencing, oligonucleotide and probe synthesis services",Agri-food and Veterinary Authority,27/12/2016,Awarded to Suppliers,AITBIOTECH PTE. LTD.,109875
AVA000ETT16000019,"Tender for two-year period contract for sequencing, oligonucleotide and probe synthesis services",Agri-food and Veterinary Authority,27/12/2016,Awarded to Suppliers,Sigma-Aldrich Pte Ltd,87663
AVA000ETT16000021,Tender for the site clearance works at Lim Chu Kang,Agri-food and Veterinary Authority,11/11/2016,Awarded to Suppliers,PENG CHUAN ENGINEERING CONSTRUCTION PTE. LTD.,252000
AVA000ETT16000023,Tender for Event Management Services for ASEAN Meeting in 2016,Agri-food and Veterinary Authority,8/9/2016,Awarded to Suppliers,THE EVENTS STATION PTE. LTD.,100920
AVA000ETT16000025,Tender for appointment of external auditor,Agri-food and Veterinary Authority,1/12/2016,Awarded to Suppliers,BDO LLP,290000
AVA000ETT16000039,Tender for event management services for responsible pet ownership event,Agri-food and Veterinary Authority,22/11/2016,Awarded to Suppliers,CITYNEON EVENTS PTE. LTD.,80000
BCA000ETT16000002,PROPOSED ESTATE UPGRADING PROGRAMME (EUP) BATCH 8 FOR HAIG ROAD AND TANJONG KATONG ESTATES,Building and Construction Authority,12/12/2016,Awarded to Suppliers,Advanced Construction & Engineering Pte Ltd,1547780
BCA000ETT16000006,"APPOINTMENT OF AN INTEGRATED MARKETING COMMUNICATIONS AGENCY TO CONCEPTUALISE, DEVELOP, IMPLEMENT AND MANAGE THE PUBLICITY CAMPAIGN FOR BIG DAY OUT 2016",Building and Construction Authority,15/4/2016,Awarded to Suppliers,ATOMZ I! PTE. LTD.,143216
BCA000ETT16000007,Term Contract for The Maintenance of Mechanical and Electrical Services at Academic Tower in BCA Academy,Building and Construction Authority,8/6/2016,Awarded to Suppliers,GWTECH ENGINEERING PTE. LTD.,1255800
BCA000ETT16000008,"CONCEPTUALISATION, DEVELOPMENT AND EVENT MANAGMEMENT FOR THE BIG DAY OUT 2016",Building and Construction Authority,16/5/2016,Awarded to Suppliers,Pico Art International Pte Ltd,498650
BCA000ETT16000009,"APPOINTMENT OF AN INTEGRATED MARKETING COMMUNICATIONS / EVENTS MANAGEMENT AGENCY TO PROVIDE CONCEPTUALISATION FOR EVENTS AND EXHIBITION MANAGEMENT SERVICES, WEBSITE MANAGEMENT AND MATERIALS FOR SINGAPORE UNIVERSAL DESIGN WEEK (SUDW) 2016",Building and Construction Authority,6/4/2016,Awarded to Suppliers,Pico Art International Pte Ltd,138350
BCA000ETT16000010,"Industry survey on CONQUAS, Quality Mark (QM) and Green and Gracious Builder Scheme (GGBS)",Building and Construction Authority,29/7/2016,Awarded to Suppliers,FROST & SULLIVAN (SINGAPORE) PTE LTD,90125
BCA000ETT16000011,"APPOINTMENT OF AN INTEGRATED MARKETING COMMUNICATIONS AGENCY TO CONCEPTULAISE, DESIGN AND IMPLEMENT PROJECT BUILD COMPETITION 2016 PUBLICITY CAMPAIGN",Building and Construction Authority,22/4/2016,Awarded to Suppliers,ADDICTION ADVERTISING PTE. LTD.,48790
BCA000ETT16000012,"BCA WINDOW SAFETY CAMPAIGN 2016 - 2017: CREATIVE CONCEPT, ARTWORK AND MEDIA BUYING",Building and Construction Authority,20/5/2016,Awarded to Suppliers,ADDICTION ADVERTISING PTE. LTD.,304919.84
BCA000ETT16000013,"OVERALL EVENT MANAGEMENT, COORDINATION AND EXECUTION FOR OPENING CEREMONY OF BCAA SKYLAB AND BCA ACADEMIC TOWER ON 20 JULY 2016",Building and Construction Authority,18/5/2016,Awarded to Suppliers,TRICOM EVENTS PRIVATE LIMITED,113209
BCA000ETT16000014,PROVISION OF TEMPORARY MANPOWER TO BUILDING AND CONSTRUCTION AUTHORITY FOR THE PERIOD 1 JUNE 2016 TO 31 MAY 2018,Building and Construction Authority,29/6/2016,Awarded to Suppliers,BGC Group Pte. Ltd.,188.65
BCA000ETT16000014,PROVISION OF TEMPORARY MANPOWER TO BUILDING AND CONSTRUCTION AUTHORITY FOR THE PERIOD 1 JUNE 2016 TO 31 MAY 2018,Building and Construction Authority,29/6/2016,Awarded to Suppliers,Business Edge Personnel Services Pte Ltd,146.18
BCA000ETT16000014,PROVISION OF TEMPORARY MANPOWER TO BUILDING AND CONSTRUCTION AUTHORITY FOR THE PERIOD 1 JUNE 2016 TO 31 MAY 2018,Building and Construction Authority,29/6/2016,Awarded to Suppliers,CAPITA PTE. LTD.,340.9
BCA000ETT16000014,PROVISION OF TEMPORARY MANPOWER TO BUILDING AND CONSTRUCTION AUTHORITY FOR THE PERIOD 1 JUNE 2016 TO 31 MAY 2018,Building and Construction Authority,29/6/2016,Awarded to Suppliers,ELITEZ PTE. LTD.,247.5
BCA000ETT16000014,PROVISION OF TEMPORARY MANPOWER TO BUILDING AND CONSTRUCTION AUTHORITY FOR THE PERIOD 1 JUNE 2016 TO 31 MAY 2018,Building and Construction Authority,29/6/2016,Awarded to Suppliers,GATES PCM CONSTRUCTION LTD.,313.69
BCA000ETT16000014,PROVISION OF TEMPORARY MANPOWER TO BUILDING AND CONSTRUCTION AUTHORITY FOR THE PERIOD 1 JUNE 2016 TO 31 MAY 2018,Building and Construction Authority,29/6/2016,Awarded to Suppliers,KELLY SERVICES (SINGAPORE) PTE. LTD.,219
BCA000ETT16000014,PROVISION OF TEMPORARY MANPOWER TO BUILDING AND CONSTRUCTION AUTHORITY FOR THE PERIOD 1 JUNE 2016 TO 31 MAY 2018,Building and Construction Authority,29/6/2016,Awarded to Suppliers,RMA CONTRACTS PTE. LTD.,235.36
BCA000ETT16000014,PROVISION OF TEMPORARY MANPOWER TO BUILDING AND CONSTRUCTION AUTHORITY FOR THE PERIOD 1 JUNE 2016 TO 31 MAY 2018,Building and Construction Authority,29/6/2016,Awarded to Suppliers,Recruit Express Pte Ltd,197.3
BCA000ETT16000014,PROVISION OF TEMPORARY MANPOWER TO BUILDING AND CONSTRUCTION AUTHORITY FOR THE PERIOD 1 JUNE 2016 TO 31 MAY 2018,Building and Construction Authority,29/6/2016,Awarded to Suppliers,SCIENTEC CONSULTING PTE. LTD.,215.9
BCA000ETT16000014,PROVISION OF TEMPORARY MANPOWER TO BUILDING AND CONSTRUCTION AUTHORITY FOR THE PERIOD 1 JUNE 2016 TO 31 MAY 2018,Building and Construction Authority,29/6/2016,Awarded to Suppliers,SKILLSFORCE MANAGEMENT CONSULTANCY PTE LTD,248.49
BCA000ETT16000014,PROVISION OF TEMPORARY MANPOWER TO BUILDING AND CONSTRUCTION AUTHORITY FOR THE PERIOD 1 JUNE 2016 TO 31 MAY 2018,Building and Construction Authority,29/6/2016,Awarded to Suppliers,TRANSCENDENT BUSINESS SERVICES PTE. LTD.,390.52
BCA000ETT16000015,MARKET RESEARCH SERVICES TO CONDUCT PUBLIC PERCEPTION SURVEY ON BCA GREEN MARK,Building and Construction Authority,1/6/2016,Awarded to Suppliers,FROST & SULLIVAN (SINGAPORE) PTE LTD,172800
BCA000ETT16000017,"Supply, Delivery, Commissioning and Testing of one (1) unit New Telescopic Handler with five (5) years of servicing and maintenance and Trade-in of one (1) unit of existing telescopic handler (JCB model 520-120) at BCA Academy",Building and Construction Authority,4/8/2016,Awarded to No Suppliers,Unknown,0
BCA000ETT16000018,Term Contract for comprehensive maintenance of horticulture works at BCA Academy,Building and Construction Authority,20/6/2016,Awarded to Suppliers,TROPIC PLANNERS & LANDSCAPE PTE. LTD.,235200
BCA000ETT16000019,Fixed Assets Management Services Using the Barcode System,Building and Construction Authority,11/8/2016,Awarded to Suppliers,ST INTEGRATED ENGINEERING PTE. LTD.,47000
BCA000ETT16000022,Engagement of International PR Agency for Singapore Green Building Week (SGBW) 2016,Building and Construction Authority,4/8/2016,Awarded to Suppliers,THE HOFFMAN AGENCY ASIA PACIFIC PTE LTD,141440
BCA000ETT16000023,DESIGN AND CONSTRUCTION OF BCA PAVILION AT BEX ASIA 2016 (07 - 09 SEP) AND SINGAPORE PAVILION AT US GREENBUILD EXPO 2016 (05 06 OCT),Building and Construction Authority,1/9/2016,Awarded to Suppliers,Pico Art International Pte Ltd,280000
BCA000ETT16000024,Term contract for conservancy & cleaning works at BCA Academy,Building and Construction Authority,23/8/2016,Awarded to Suppliers,ABSOLUTE MAINTENANCE SERVICES PTE LTD,2462700
BCA000ETT16000025,Term Contract for the maintenance & improvement to existing Electrical Installation in BCA Academy,Building and Construction Authority,24/8/2016,Awarded to Suppliers,ELIKTRICAL ENGINEERING PTE. LTD.,150000
BCA000ETT16000026,"TERM CONTRACT FOR THE INSPECTION, MAINTENANCE AND POSITIONAL SURVEY OF MOORING BUOYS OFF THE COAST OF PULAU PUNGGOL BARAT",Building and Construction Authority,19/8/2016,Awarded to Suppliers,HSL Constructor Pte Ltd,3750
BCA000ETT16000026,"TERM CONTRACT FOR THE INSPECTION, MAINTENANCE AND POSITIONAL SURVEY OF MOORING BUOYS OFF THE COAST OF PULAU PUNGGOL BARAT",Building and Construction Authority,19/8/2016,Awarded to Suppliers,IMD CONTRACTORS PTE. LTD.,21450
BCA000ETT16000029,APPOINTMENT OF AN EXHIBITION SPECIALIST TO DESIGN AND CONSTRUCT BCA PAVILION AND AGENCIES PAVILION (OPTIONAL) AT THE BUILDTECH ASIA 2016 EXHIBITION,Building and Construction Authority,13/10/2016,Awarded to Suppliers,Pico Art International Pte Ltd,358950
BCA000ETT16000032,"CONCEPTUALISATION, DEVELOPMENT AND EVENT MANAGEMENT FOR PROJECT BUILD EXHIBITION 2016",Building and Construction Authority,23/9/2016,Awarded to Suppliers,Kingsmen Exhibits Pte Ltd,177670
BCA000ETT16000034,DEVELOPMENT AND MANAGEMENT OF PROJECT BUILD EXHIBITION 2016 PUBLICITY CAMPAIGN,Building and Construction Authority,29/9/2016,Awarded to Suppliers,ATOMZ I! PTE. LTD.,141577
BCA000ETT16000036,REPAIR AND RESTORATION OF PULAU PUNGGOL AGGREGATE TERMINAL AND TUAS AGGREGATE TERMINAL,Building and Construction Authority,28/12/2016,Awarded to Suppliers,SING TEC DEVELOPMENT PTE. LTD.,11000000
BCA000ETT16000039,PROVISION OF MEDICAL SERVICES TO BUILDING AND CONSTRUCTION AUTHORITY FOR THE PERIOD 1 JAN 2017 TO 31 DEC 2019,Building and Construction Authority,19/12/2016,Awarded to Suppliers,PARKWAY SHENTON PTE LTD,312240
BCA000ETT16000045,Insurance Coverage for Building and Construction Authority for a period of two (2) years commencing from 1 Dec 2016 to 30 Nov 2018.,Building and Construction Authority,23/12/2016,Awarded to Suppliers,KIB INSURANCE BROKERS (S) PTE LTD,110700.98
CAA000ETT15000049,"Design, development and implementation services of software system to administer and manage courses and programmes",Civil Aviation Authority of Singapore,29/4/2016,Awarded to Suppliers,NCS PTE. LTD.,1835168
CAA000ETT15000066,Provision of consultancy services to design a passenger centralised data management system,Civil Aviation Authority of Singapore,1/4/2016,Awarded to Suppliers,SITA INFORMATION NETWORKING COMPUTING (ASIA PACIFIC) PTE LTD,390000
CAA000ETT15000080,Construction Of Equipment Buildings And Facilities At Singapore Changi Airport,Civil Aviation Authority of Singapore,18/5/2016,Awarded to Suppliers,SCB BUILDING CONSTRUCTION PTE. LTD.,29380000
CAA000ETT16000004,Replacement of Advanced Surface Movement Guidance and Control System and Multilateration System,Civil Aviation Authority of Singapore,5/12/2016,Awarded to Suppliers,SAAB TECHNOLOGIES B.V.,17994144
CAA000ETT16000005,Provision of Electronic Key Management System,Civil Aviation Authority of Singapore,25/4/2016,Awarded to Suppliers,Coselec Pte Ltd,120800
CAA000ETT16000007,Provision of instrument flight procedures design system and related maintenance,Civil Aviation Authority of Singapore,13/10/2016,Awarded to Suppliers,NCS COMMUNICATIONS ENGINEERING PTE. LTD.,667986
CAA000ETT16000013,Provision and maintenance of a computer-based examination system for a period of 5 years,Civil Aviation Authority of Singapore,3/5/2016,Awarded to Suppliers,ASPEQ LIMITED,3397000
CAA000ETT16000014,Replacement of UH1H Helicopter Simulator at Selarang Fire Training Ground,Civil Aviation Authority of Singapore,31/5/2016,Awarded to Suppliers,HEXCEL SOLUTIONS PTE. LTD.,148930
CAA000ETT16000015,Provision of Leadership Development Programmes for Officers in the Civil Aviation Authority of Singapore,Civil Aviation Authority of Singapore,30/6/2016,Awarded to Suppliers,SEQUOIA GROUP PTE. LTD.,301000
CAA000ETT16000017,Implementation of Medium-altitude Earth Orbit Search and Rescue (MEOSAR) Ground System,Civil Aviation Authority of Singapore,23/12/2016,Awarded to Suppliers,"MCMURDO, INC.",6183366
CAA000ETT16000018,Supply and delivery of two motor vehicles inclusive of valid 10-year COE,Civil Aviation Authority of Singapore,7/6/2016,Awarded to Suppliers,CYCLE & CARRIAGE AUTOMOTIVE PTE LIMITED,244357.28
CAA000ETT16000019,Provision of Vehicle Crash Barrier System,Civil Aviation Authority of Singapore,20/6/2016,Awarded to Suppliers,GLASS@WORX PTE. LTD.,185000
CAA000ETT16000020,Replacement of Fan Coil Units and Variable Refrigerant Volume Air-Conditioning Systems,Civil Aviation Authority of Singapore,1/7/2016,Awarded to Suppliers,S&P SYSTEM SERVICES PTE. LTD.,834100
CAA000ETT16000021,Upgrading Works And Term Contract For Adhoc Minor Works To CAAS Premises And Properties In Singapore And Offshore Islands,Civil Aviation Authority of Singapore,20/7/2016,Awarded to Suppliers,CHUA YEW SENG CONSTRUCTION & ELECTRICAL ENGRG PTE LTD,454750
CAA000ETT16000022,Provision Of Infra-Red Thermographic Scanning Services,Civil Aviation Authority of Singapore,27/6/2016,Awarded to Suppliers,Setsco Services Pte Ltd,84960
CAA000ETT16000023,Provision of enterprise - Safety Oversight Management System (eSOMs) with maintenance services,Civil Aviation Authority of Singapore,29/12/2016,Awarded to Suppliers,NCS PTE. LTD.,5500767.37
CAA000ETT16000025,Supply and Delivery of Two 7-Seater Vehicles Inclusive of Valid 10 Years COE,Civil Aviation Authority of Singapore,7/7/2016,Awarded to Suppliers,BORNEO MOTORS (SINGAPORE) PTE. LTD.,230000
CAA000ETT16000026,Appointment of Insurance Broker for Group Personal Accident (GPA) Insurance Policy for CAAS,Civil Aviation Authority of Singapore,30/6/2016,Awarded to Suppliers,ACCLAIM INSURANCE BROKERS PTE. LTD.,53290.76
CAA000ETT16000027,Replacement of air-conditioning units and fan system,Civil Aviation Authority of Singapore,8/9/2016,Awarded to Suppliers,JA ENGINEERING AND TRADING PTE. LTD.,172000
CAA000ETT16000028,"Engagement of entertainment artiste for CAAS event at Montreal, Canada",Civil Aviation Authority of Singapore,10/8/2016,Awarded to Suppliers,SONY MUSIC ENTERTAINMENT SINGAPORE (PTE.) LTD.,69000
CAA000ETT16000029,Provision of Photography Services for CAAS,Civil Aviation Authority of Singapore,22/8/2016,Awarded to Suppliers,FIREFLY PHOTOGRAPHY PTE. LTD.,3900
CAA000ETT16000029,Provision of Photography Services for CAAS,Civil Aviation Authority of Singapore,22/8/2016,Awarded to Suppliers,Howie Photography,5020
CAA000ETT16000031,Purchase of Media Space in The Straits Times,Civil Aviation Authority of Singapore,30/6/2016,Awarded to Suppliers,LINS ADVERTISING & MARKETING PTE LTD,104008.52
CAA000ETT16000032,Supply and delivery of two vehicles inclusive of valid 10-year COE,Civil Aviation Authority of Singapore,10/10/2016,Awarded to Suppliers,VANTAGE AUTOMOTIVE LIMITED,140625.84
CAA000ETT16000035,Supply and Installation of Air Traffic Control Consoles,Civil Aviation Authority of Singapore,26/9/2016,Awarded to Suppliers,DATUMSTRUCT (CFS) PTE. LTD.,159500
CAA000ETT16000037,Supply of Card Access Control System and Closed Circuit TV (CCTV) System,Civil Aviation Authority of Singapore,19/9/2016,Awarded to Suppliers,CERTIS TECHNOLOGY (SINGAPORE) PTE. LTD.,199000
CAA000ETT16000038,Provision of Maintenance and Support Services for Computer Hardware and IT Network Equipment for a period of two years,Civil Aviation Authority of Singapore,1/9/2016,Awarded to Suppliers,NCS PTE. LTD.,533263.97
CAA000ETT16000039,Replacement of Mechanical & Electrical Systems at CAAS Premises,Civil Aviation Authority of Singapore,24/10/2016,Awarded to Suppliers,KANDENKO CO LTD,447500
CAA000ETT16000040,Supply and delivery of Mock-up Cargo and Related Services for Aviation Challenge 2,Civil Aviation Authority of Singapore,1/11/2016,Awarded to Suppliers,AIRPORT EQUIPMENT SERVICES PTE LTD,150300
CAA000ETT16000044,Consultancy study for the review of aviation security frameworks for air navigation services,Civil Aviation Authority of Singapore,23/11/2016,Awarded to Suppliers,ARUP SINGAPORE PRIVATE LIMITED,490000
CAA000ETT16000045,Provision of Aviation and Public Liability Insurance Broking Services,Civil Aviation Authority of Singapore,27/10/2016,Awarded to Suppliers,Jardine Lloyd Thompson Private Limited,75000
CAA000ETT16000046,Provision of consultancy services on airport users' requirements and satisfaction with facilities and services at Changi Airport,Civil Aviation Authority of Singapore,10/11/2016,Awarded to No Suppliers,Unknown,0
CAA000ETT16000051,Provision of Consultancy Services for Job Evaluation Exercise,Civil Aviation Authority of Singapore,23/11/2016,Awarded to Suppliers,MERCER (SINGAPORE) PTE. LTD.,70980
CAA000ETT16000057,Provision of Offshore Accommodation Vessel for Workshop on Underwater Search of Flight Recorders,Civil Aviation Authority of Singapore,24/11/2016,Awarded to No Suppliers,Unknown,0
CAA000ETT16000060,Provision of consultancy services for the impact assessment of Single Process implementation at Singapore Changi Airport,Civil Aviation Authority of Singapore,29/12/2016,Awarded to Suppliers,SEABURY CARGO ADVISORY B.V.,260000
CAA000ETT16000061,Supply and delivery of one utility lorry inclusive of valid 10-year COE,Civil Aviation Authority of Singapore,5/12/2016,Awarded to Suppliers,FOTON MOTOR AUV (SINGAPORE) PTE. LTD.,113099
CCS000ETT16000003,Provision and Installation of New Access Card Reader System and Comprehensive Maintenance for Security System,Competition and Consumer Commission of Singapore (CCCS),15/4/2016,Awarded to Suppliers,CERTIS TECHNOLOGY (SINGAPORE) PTE. LTD.,84350
CCS000ETT16000006,Provision of Renovation Works of Office Rooms For Competition Commission Of Singapore (CCS),Competition and Consumer Commission of Singapore (CCCS),17/8/2016,Awarded to Suppliers,Aspacio Design Associates Pte Ltd,107769
CCS000ETT16000007,"Provision of Consultancy Services on ""Competition Policy, E-Commerce and Big Data in ASEAN""",Competition and Consumer Commission of Singapore (CCCS),21/12/2016,Awarded to Suppliers,PRICEWATERHOUSECOOPERS CONSULTING (SINGAPORE) PTE. LTD.,393600
CCY000ETT16000001,"Invitation to tender for the supply, design, development, delivery, installation, testing, training, and commissioning of a fully operational Record Management System with an option for maintenance.","Ministry of Culture, Community and Youth - Ministry Headquarter",7/11/2016,Awarded to Suppliers,ATOS INFORMATION TECHNOLOGY (SINGAPORE) PTE. LTD.,2025782.67
CCY000ETT16000002,"Request for Proposal (""RFP"") for the conceptualization, development and implementation of an Integrated Digital Communications Plan to strengthen the Singapore spirit and connection to Singapore.","Ministry of Culture, Community and Youth - Ministry Headquarter",1/9/2016,Awarded to Suppliers,OGILVY SINGAPORE PTE. LTD.,2499098
