tender_no,tender_description,agency,award_date,tender_detail_status,supplier_name,awarded_amt
EDB000ETT16000012,Invitation to Tender (T14/2016) for The Appointment of External Auditor for EDB and EDB subsidiaries.,Economic Development Board,31/10/2016,Awarded to Suppliers,KPMG LLP,465000
EDB000ETT16000013,"Tender T19/2016 Propose, Supply, Deliver, Install, Test, and Commission Dedicated Internet Leased Lines to EDB. OIC Sieng Tong Ping (PR 20161211).",Economic Development Board,7/11/2016,Awarded to Suppliers,TATA COMMUNICATIONS INTERNATIONAL PTE. LTD.,650001.96
EMA000ETT15000029,"TENDER FOR THE PROVISION OF EVENT MANAGEMENT SERVICES FOR THE SINGAPORE INTERNATIONAL ENERGY WEEK (""SIEW"") 2016 WITH AN OPTION TO EXTEND FOR SIEW 2017",Energy Market Authority of Singapore,19/5/2016,Awarded to Suppliers,TRICOM EVENTS PRIVATE LIMITED,1198700
EMA000ETT16000002,"PROVISION OF ADVISORY SERVICES ON ECONOMIC REGULATION, MARKET DEVELOPMENT AND SURVEILLANCE, AND POLICY FORMULATION OF THE ENERGY (ELECTRICITY AND GAS) SECTOR FOR A PERIOD OF TWO YEARS",Energy Market Authority of Singapore,6/4/2016,Awarded to No Suppliers,Unknown,0
EMA000ETT16000004,"INVITATION TO TENDER FOR REPLACEMENT OF AIR-CONDITIONING SYSTEM AT THE OFFICES OF ENERGY MARKET AUTHORITY, 991G ALEXANDRA ROAD, #01-29 AND #02-29",Energy Market Authority of Singapore,12/4/2016,Awarded to Suppliers,PUBLIC AIR TECHNOLOGY PTE LTD,186840
EMA000ETT16000005,CONSULTANCY SERVICES FOR THE REVIEW OF VESTING PRICE PARAMETERS FOR 2017-2018,Energy Market Authority of Singapore,7/4/2016,Awarded to Suppliers,WSP CONSULTANCY PTE. LTD.,199810
EMA000ETT16000006,"PROVISION OF CONSULTANCY SERVICES ON ECONOMIC REGULATION, MARKET DEVELOPMENT AND SURVEILLANCE OF THE ENERGY (ELECTRICITY AND GAS) SECTOR FOR A PERIOD OF TWO YEARS",Energy Market Authority of Singapore,3/6/2016,Awarded to Suppliers,Frontier Economics Pty Ltd,10719
EMA000ETT16000006,"PROVISION OF CONSULTANCY SERVICES ON ECONOMIC REGULATION, MARKET DEVELOPMENT AND SURVEILLANCE OF THE ENERGY (ELECTRICITY AND GAS) SECTOR FOR A PERIOD OF TWO YEARS",Energy Market Authority of Singapore,3/6/2016,Awarded to Suppliers,THE LANTAU GROUP (HK) LIMITED,54650
EMA000ETT16000007,INVITATION TO TENDER FOR THE PROVISION OF DAILY MEDIA MONITORING SERVICES,Energy Market Authority of Singapore,11/5/2016,Awarded to Suppliers,NEWS SEARCH (SINGAPORE) PTE. LTD.,57600
EMA000ETT16000011,Provision of training services to facilitate and conduct in-house courses for Energy Market Authority,Energy Market Authority of Singapore,15/6/2016,Awarded to Suppliers,EDVANTEDGE PRIVATE LIMITED,15600
EMA000ETT16000011,Provision of training services to facilitate and conduct in-house courses for Energy Market Authority,Energy Market Authority of Singapore,15/6/2016,Awarded to Suppliers,Mind Map Training Centre Pte Ltd,8000
EMA000ETT16000011,Provision of training services to facilitate and conduct in-house courses for Energy Market Authority,Energy Market Authority of Singapore,15/6/2016,Awarded to Suppliers,POWEREDGE PTE. LTD.,27007.4
EMA000ETT16000011,Provision of training services to facilitate and conduct in-house courses for Energy Market Authority,Energy Market Authority of Singapore,15/6/2016,Awarded to Suppliers,SEAT OF WISDOM CONSULTANCY SERVICES PTE. LTD.,8120
EMA000ETT16000011,Provision of training services to facilitate and conduct in-house courses for Energy Market Authority,Energy Market Authority of Singapore,15/6/2016,Awarded to Suppliers,SPECTRUM MANAGEMENT CONSULTING PTE. LTD.,37200
EMA000ETT16000012,PROVISION OF APPLICATION MAINTENANCE AND SUPPORT SERVICES FOR ENERGY MARKET AUTHORITY'S ENERGY INFORMATION MANAGEMENT PORTAL,Energy Market Authority of Singapore,25/8/2016,Awarded to Suppliers,ARETHOS PTE. LTD.,60000
EMA000ETT16000013,FEASIBILITY STUDY ON USING FLOATING LNG SOLUTIONS,Energy Market Authority of Singapore,16/6/2016,Awarded to Suppliers,DNV GL SINGAPORE PTE. LTD.,269500
EMA000ETT16000014,PROVISION OF CONSULTANCY SERVICES FOR LNG RELATED LEGAL SERVICES,Energy Market Authority of Singapore,18/7/2016,Awarded to Suppliers,DENTONS UKMEA LLP,8078
EMA000ETT16000014,PROVISION OF CONSULTANCY SERVICES FOR LNG RELATED LEGAL SERVICES,Energy Market Authority of Singapore,18/7/2016,Awarded to Suppliers,KING & SPALDING (SINGAPORE) LLP,6425.96
EMA000ETT16000014,PROVISION OF CONSULTANCY SERVICES FOR LNG RELATED LEGAL SERVICES,Energy Market Authority of Singapore,18/7/2016,Awarded to Suppliers,NORTON ROSE FULBRIGHT (ASIA) LLP,5355
EMA000ETT16000015,PROVISION OF CONSULTANCY SERVICES TO ASSIST IN THE IMPLEMENTATION OF GAS SAFETY CODE,Energy Market Authority of Singapore,1/9/2016,Awarded to Suppliers,DNV GL SINGAPORE PTE. LTD.,889
EMA000ETT16000015,PROVISION OF CONSULTANCY SERVICES TO ASSIST IN THE IMPLEMENTATION OF GAS SAFETY CODE,Energy Market Authority of Singapore,1/9/2016,Awarded to Suppliers,TUV RHEINLAND SINGAPORE PTE. LTD.,1325
EMA000ETT16000015,PROVISION OF CONSULTANCY SERVICES TO ASSIST IN THE IMPLEMENTATION OF GAS SAFETY CODE,Energy Market Authority of Singapore,1/9/2016,Awarded to Suppliers,WORLEYPARSONS PTE. LIMITED,500
EMA000ETT16000016,Appointment of External Auditor for the Financial Year ending 31 March 2017 and Option to renew the appointment for another four Financial Years on an annual basis,Energy Market Authority of Singapore,14/9/2016,Awarded to Suppliers,PRICEWATERHOUSECOOPERS LLP,51000
EMA000ETT16000017,APPLICATION SUPPORT SERVICES FOR ENERGY MARKET AUTHORITY,Energy Market Authority of Singapore,25/8/2016,Awarded to Suppliers,EMERIO GLOBESOFT PTE. LTD.,150024
EMA000ETT16000018,CONSULTANCY SERVICE TO ADVICE ON IMPLEMENTATION STEPS TO TRANSITION TO EVENTUAL SECONDARY GAS TRADING MARKET IN SINGAPORE,Energy Market Authority of Singapore,9/9/2016,Awarded to Suppliers,Frontier Economics Pty Ltd,1771955
EMA000ETT16000019,"REQUEST FOR PROPOSAL (""RFP"") TO CONDUCT RESEARCH STUDY AND DEVELOP COMMUNICATIONS/EDUCATION PLAN FOR FULL RETAIL COMPETITION (""FRC"")",Energy Market Authority of Singapore,5/9/2016,Awarded to Suppliers,GREY GROUP PTE. LTD.,496998
EMA000ETT16000020,"Tender for the Provision of Event Venue, Food & Beverage, Hotel Accommodation and Other Facilities for the Singapore International Energy Week (SIEW) 2017",Energy Market Authority of Singapore,30/9/2016,Awarded to Suppliers,MARINA BAY SANDS PTE. LTD.,1166737.5
EMA000ETT16000021,"Provision of goods and services for the design, supply, installation, testing, commissioning and maintenance of the EMA Singapore International Energy Week (SIEW) 2017-2018 website with an option to extend for SIEW 2019",Energy Market Authority of Singapore,19/10/2016,Awarded to Suppliers,FXMEDIA INTERNET PTE. LTD.,395600
EMA000ETT16000022,PROVISION OF INTEGRATED CALL CENTRE SERVICES FOR THE ENERGY MARKET AUTHORITY,Energy Market Authority of Singapore,26/9/2016,Awarded to Suppliers,CONNECT CENTRE PTE. LTD.,99900
EMA000ETT16000023,Provision of Charging Services and Other Related Services for the Electric Vehicle Phase 1 Test-Bed Participants.,Energy Market Authority of Singapore,23/9/2016,Awarded to Suppliers,ROBERT BOSCH (SOUTH EAST ASIA) PTE. LTD.,885365
EMA000ETT16000025,"Provision of Venue, Event Management and Other Related Services for the 53rd Asia-Pacific Economic Cooperation (APEC) Energy Working Group (EWG 53) and Associated Meetings in Singapore on 24-28 April 2017",Energy Market Authority of Singapore,13/11/2016,Awarded to Suppliers,EUREKA! CAMPAIGN ASSOCIATES PTE. LTD.,166976
EMA000ETT16000026,ADVISORY SERVICE FOR INTEREST RATE HEDGING POLICY AND EXECUTION,Energy Market Authority of Singapore,10/10/2016,Awarded to Suppliers,KPMG SERVICES PTE. LTD.,129000
EMA000ETT16000027,"Supply, delivery, installation, testing and commissioning of a Sectorial Detection & Early Warning System with comprehensive maintenance of the system",Energy Market Authority of Singapore,30/11/2016,Awarded to Suppliers,PCS SECURITY PRIVATE LIMITED,490140
EMA000ETT16000028,Retainer Service To Advise On Energy Peak Load Shifting And Demand-Side Management Initiatives,Energy Market Authority of Singapore,12/12/2016,Awarded to Suppliers,ACCENTURE PTE LTD,3187.5
EMA000ETT16000028,Retainer Service To Advise On Energy Peak Load Shifting And Demand-Side Management Initiatives,Energy Market Authority of Singapore,12/12/2016,Awarded to Suppliers,ICF CONSULTING INDIA PRIVATE LIMITED,1172
EMA000ETT16000028,Retainer Service To Advise On Energy Peak Load Shifting And Demand-Side Management Initiatives,Energy Market Authority of Singapore,12/12/2016,Awarded to Suppliers,Siemens Pte Ltd,2313
EMA000ETT16000030,PROVISION OF IT APPLICATIONS SERVICES TO ENERGY MARKET AUTHORITY,Energy Market Authority of Singapore,30/12/2016,Awarded to Suppliers,NUVISTA TECHNOLOGIES PTE. LTD.,253800
ENV000ETT16000003,TENDER FOR PROVISION OF SERVICES FOR THE DIGITIZATION OF HARDCOPY FILES AND DOCUMENTS FOR THE MINISTRY OF THE ENVIRONMENT AND WATER RESOURCES (MEWR),Ministry of the Environment and Water Resources,2/6/2016,Awarded to Suppliers,KONICA MINOLTA BUSINESS SOLUTIONS ASIA PTE. LTD.,194350
ENV000ETT16000008,TENDER FOR PROVISION OF EVENT MANAGEMENT SERVICES FOR WORKING GROUP AND STEERING COMMITTEE MEETINGS FROM 3 to 4 MAY 2016 FOR THE MINISTRY OF ENVIRONMENT AND WATER RESOURCES,Ministry of the Environment and Water Resources,21/4/2016,Awarded to Suppliers,LINEAR DOTS PRODUCTION PTE. LTD.,90072
ENV000ETT16000010,Provision Of Consultancy Services To Conduct A Feasibility Study On Policy Tools For Greenhouse Gas Mitigation In Singapore for MEWR,Ministry of the Environment and Water Resources,14/6/2016,Awarded to Suppliers,ECOFYS NETHERLANDS B.V.,266000
ENV000ETT16000011,TENDER FOR PREVENTIVE AND CORRECTIVE MAINTENANCE WORKS FOR THE ENVISION GALLERY IN THE MINISTRY OF THE ENVIRONMENT AND WATER RESOURCES,Ministry of the Environment and Water Resources,27/5/2016,Awarded to Suppliers,Pico Art International Pte Ltd,120000
ENV000ETT16000017,TENDER FOR PROVISION OF EVENT MANAGEMENT SERVICES FOR THE PRESIDENTS AWARD FOR THE ENVIRONMENT (PAE) AWARDS CEREMONY 2016 THE ENVIRONMENT BUILDING 40 SCOTTS,Ministry of the Environment and Water Resources,24/6/2016,Awarded to Suppliers,TWIST MEDIA PTE. LTD.,95781
ENV000ETT16000019,Invitation To Tender For Event Management Services For The Sustainable Singapore Blueprint (SSB) Event For The Ministry Of The Environment And Water Resources,Ministry of the Environment and Water Resources,3/6/2016,Awarded to Suppliers,TWIST MEDIA PTE. LTD.,160725
ENV000ETT16000020,TENDER FOR THE PROVISION OF SECURITY SERVICES TO THE MINISTRY OF THE ENVIRONMENT AND WATER RESOURCES FOR A PERIOD OF 2 YEARS WITH AN OPTION TO EXTEND FOR ANOTHER 2 YEARS,Ministry of the Environment and Water Resources,31/10/2016,Awarded to Suppliers,Excellent Security & Safety Pte Ltd,2460000
ENV000ETT16000026,"TENDER FOR THE PROPOSED ADDITION & ALTERATION TO EXISTING ENVIRONMENT BUILDING AND ANNEX ON LOTS 01280M PT, 00578A, 99725L & 99726C TS 27 AT 40 SCOTTS ROAD (NEWTON PLANNING AREA)",Ministry of the Environment and Water Resources,4/11/2016,Awarded to Suppliers,GENNAL INDUSTRIES PTE LTD,19837672.7
ENV000ETT16000028,TENDER FOR REPLACEMENT OF CARD ACCESS SYSTEM AND COMPREHENSIVE MAINTENANCE SERVICES AT THE ENVIRONMENT BUILDING,Ministry of the Environment and Water Resources,30/12/2016,Awarded to Suppliers,ROBERT BOSCH SECURITY SOLUTIONS PTE. LTD.,308040
FINAGDETT16000001,Office Renovation Works At Accountant-General's Department,Ministry of Finance-Accountant-General's Department,6/4/2016,Awarded to Suppliers,GRAND BUILD INTERIOR PTE. LTD.,156880
FINAGDETT16000004,Provision of Audit Services under a Framework Agreement for Accountant-General's Department,Ministry of Finance-Accountant-General's Department,14/7/2016,Awarded to Suppliers,BDO LLP,72000
FINAGDETT16000004,Provision of Audit Services under a Framework Agreement for Accountant-General's Department,Ministry of Finance-Accountant-General's Department,14/7/2016,Awarded to Suppliers,DELOITTE & TOUCHE ENTERPRISE RISK SERVICES PTE LTD,72000
FINAGDETT16000004,Provision of Audit Services under a Framework Agreement for Accountant-General's Department,Ministry of Finance-Accountant-General's Department,14/7/2016,Awarded to Suppliers,ERNST & YOUNG ADVISORY PTE. LTD.,72000
FINAGDETT16000004,Provision of Audit Services under a Framework Agreement for Accountant-General's Department,Ministry of Finance-Accountant-General's Department,14/7/2016,Awarded to Suppliers,"KONG, LIM & PARTNERS LLP",72000
FINAGDETT16000004,Provision of Audit Services under a Framework Agreement for Accountant-General's Department,Ministry of Finance-Accountant-General's Department,14/7/2016,Awarded to Suppliers,RSM RISK ADVISORY PTE. LTD.,72000
FINAGDETT16000006,Provision of Training Services in Leadership Development for The Accountant-General's Department,Ministry of Finance-Accountant-General's Department,15/12/2016,Awarded to Suppliers,ROFFEY PARK ASIA PACIFIC PTE. LTD.,109800
FINCEDETT15000011,Tender for the proposed new erection of Customs Command Complex comprising a 6-STOREY block with 2-basement and a 6-storey Annex Block at Jalan Bahar,Ministry of Finance - Singapore Customs,23/9/2016,Awarded to Suppliers,NEWCON BUILDERS PTE. LTD.,61380000
FINCEDETT16000001,TENDER FOR THE PROVISION OF ARMED APO AND APO (ENFORCEMENT) FOR CUSTOMS FIELD ENFORCEMENT FOR 1 YEAR WITH AN OPTION TO EXTEND ON YEARLY BASIS FOR ANOTHER 2 YEARS.,Ministry of Finance - Singapore Customs,24/5/2016,Awarded to Suppliers,AETOS SECURITY MANAGEMENT PTE. LTD.,3681465
FINCEDETT16000002,"Tender for Nominated Sub-Contract for supply, installation and monitoring of instruments for the proposed new erection of Customs Operation Command Complex",Ministry of Finance - Singapore Customs,14/10/2016,Awarded to Suppliers,GROUND INSTRUMENTATION & ENGINEERING PTE. LTD.,197044
FINCEDETT16000006,TENDER FOR THE PROVISION OF COURIER SERVICES FOR SINGAPORE CUSTOMS FOR A PERIOD OF 2 YEARS WITH AN OPTION TO EXTEND THE CONTRACT FOR 1 YEAR,Ministry of Finance - Singapore Customs,30/8/2016,Awarded to Suppliers,HEW TRANSPORTATION PTE. LTD.,83088
FINCEDETT16000007,TENDER FOR THE PROVISION OF DESTRUCTION SERVICES FOR FORFEITED CASE EXHIBITS FOR SINGAPORE CUSTOMS FOR A PERIOD OF 2 YEARS,Ministry of Finance - Singapore Customs,3/10/2016,Awarded to Suppliers,SEMBWASTE PTE. LTD.,79200
FINCEDETT16000008,"TENDER FOR THE DESIGN, TAILOR AND DELIVERY OF MADE-TO-MEASURE UNIFORM FOR SINGAPORE CUSTOMS CUSTOMER SERVICE ASSOCIATES (CSA)",Ministry of Finance - Singapore Customs,24/11/2016,Awarded to Suppliers,ESTA PTE. LTD.,118590
FINCEDETT16000009,TENDER FOR THE PROVISION OF PERIODIC SERVICING AND MAINTENANCE OF DEPARTMENTAL MOTOR VEHICLES FOR SINGAPORE CUSTOMS,Ministry of Finance - Singapore Customs,18/10/2016,Awarded to Suppliers,LIM TAN MOTOR PTE LTD,67848.1
FINCEDETT16000014,This is an electronic non-GPA-covered open tender for the provision of casual labourers and transportation services to Singapore Customs for a period of two (2) years.,Ministry of Finance - Singapore Customs,21/12/2016,Awarded to Suppliers,SYDHA MOVERS PTE. LTD.,194800
FINHQ0ETT16000001,"Proposal for the Supply, Design, Development, Delivery, Installation, Testing, Training and Commissioning of a Fully Operational Social Policy Management System for MOFHQ",Ministry of Finance-Ministry Headquarter,7/9/2016,Awarded to Suppliers,DXC TECHNOLOGY SINGAPORE PTE. LTD.,3172134
FINHQ0ETT16000003,TERM CONTRACT FOR THE MAINTENANCE OF MECHANICAL AND ELECTRIAL (M&E) SYSTEMS AT THE TREASURY,Ministry of Finance-Ministry Headquarter,20/7/2016,Awarded to Suppliers,GDS ENGINEERING PTE LTD,2145600
FINHQ0ETT16000004,Provision of Event Management Services for PS21 ExCEL Convention 2016,Ministry of Finance-Ministry Headquarter,14/7/2016,Awarded to Suppliers,SKYY CREATIVE CONSULTANT PTE. LTD.,92396
FINHQ0ETT16000006,PROVISION OF ARMED AND UNARMED SECURITY GUARD SERVICES AT THE TREASURY FOR A BASE PERIOD OF THREE (3) YEARS WITH AN OPTION TO EXTEND FOR ANOTHER TWO (2) YEARS,Ministry of Finance-Ministry Headquarter,28/6/2016,Awarded to Suppliers,CERTIS CISCO AUXILIARY POLICE FORCE PTE. LTD.,7334628
FINHQ0ETT16000007,"SUPPLY, DELIVERY AND INSTALLATION OF CRASH BARRIER SYSTEM INCLUDING PROVISION OF NON-COMPREHENSIVE MAINTENANCE OF THE CRASH BARRIER SYSTEM FOR A PERIOD OF ONE YEAR AT THE TREASURY",Ministry of Finance-Ministry Headquarter,10/8/2016,Awarded to Suppliers,TJ Systems (S) Pte Ltd,94880
FINHQ0ETT16000009,PROPOSAL FOR THE IMPLEMENTATION OF A FULLY OPERATIONAL FINANCE AND PROCUREMENT PORTAL AND IM PORTAL WITH AN OPTION FOR MAINTENANCE,Ministry of Finance-Ministry Headquarter,13/12/2016,Awarded to Suppliers,Web Professional House Pte Ltd,818470
FINHQ0ETT16000010,TENDER FOR THE PROVISION OF SERVICES TO OPERATE GOVERNMENT SUPPLIER REGISTRATION SERVICES (GSR) FOR A PERIOD OF ONE YEAR WITH OPTIONS TO EXTEND UP TO AN ADDITIONAL 24 MONTHS,Ministry of Finance-Ministry Headquarter,11/10/2016,Awarded to Suppliers,CRIMSONLOGIC PTE LTD,75.7
FINHQ0ETT16000011,"Proposal for the Supply, Design, Development, Delivery, Installation, Testing, Training and Commissioning of a Fully Operational MOF Intranet Upgrade with an Option for Maintenance",Ministry of Finance-Ministry Headquarter,23/11/2016,Awarded to Suppliers,DXC TECHNOLOGY SINGAPORE PTE. LTD.,1967875
FINHQ0ETT16000013,RENTAL OF X-RAY MACHINE AND MAIL X-RAY SCANNER INCLUDING THE DISPOSAL OF EXISTING X-RAY MACHINE AT THE TREASURY FOR A BASE PERIOD OF TWO (2) YEAR WITH AN OPTION TO EXTEND FOR ANOTHER TWO (2) YEAR,Ministry of Finance-Ministry Headquarter,7/10/2016,Awarded to Suppliers,NIMROD ENGINEERING PTE LTD,38201
FINHQ0ETT16000015,Proposed Addition And Alteration Interior Fit-Out Works to Level 8 And Level 10 Conference Room At The Treasury,Ministry of Finance-Ministry Headquarter,7/11/2016,Awarded to Suppliers,P & A LINK PTE LTD,350820
FINHQ0ETT16000016,COMPREHENSIVE MAINTENANCE OF AUDIO VISUAL SYSTEM AT THE TREASURY FOR A BASE PERIOD OF TWO (2) YEARS WITH AN OPTION TO EXTEND FOR ANOTHER TWO (2) YEARS,Ministry of Finance-Ministry Headquarter,19/12/2016,Awarded to Suppliers,SYNERGY AVL PTE. LTD.,146696.2
FINVITETT15000022,Invitation to Tender for the implementation of a Debt Recovery System,Ministry of Finance - Vital,2/6/2016,Awarded to No Suppliers,Unknown,0
FINVITETT16000001,"Provision of Temporary Contract for Services, Temporary Employee Conversion to Permanent Employee and Sourcing for Permanent Employee",Ministry of Finance - Vital,19/7/2016,Awarded to Suppliers,BGC Group Pte. Ltd.,4420
FINVITETT16000001,"Provision of Temporary Contract for Services, Temporary Employee Conversion to Permanent Employee and Sourcing for Permanent Employee",Ministry of Finance - Vital,19/7/2016,Awarded to Suppliers,Business Edge Personnel Services Pte Ltd,4153.2
FINVITETT16000001,"Provision of Temporary Contract for Services, Temporary Employee Conversion to Permanent Employee and Sourcing for Permanent Employee",Ministry of Finance - Vital,19/7/2016,Awarded to Suppliers,EDUCARE HUMAN CAPITAL PRIVATE LIMITED,4263
FINVITETT16000001,"Provision of Temporary Contract for Services, Temporary Employee Conversion to Permanent Employee and Sourcing for Permanent Employee",Ministry of Finance - Vital,19/7/2016,Awarded to Suppliers,PEOPLE ADVANTAGE PTE. LTD.,4248
FINVITETT16000001,"Provision of Temporary Contract for Services, Temporary Employee Conversion to Permanent Employee and Sourcing for Permanent Employee",Ministry of Finance - Vital,19/7/2016,Awarded to Suppliers,SCIENTEC CONSULTING PTE. LTD.,4300
FINVITETT16000001,"Provision of Temporary Contract for Services, Temporary Employee Conversion to Permanent Employee and Sourcing for Permanent Employee",Ministry of Finance - Vital,19/7/2016,Awarded to Suppliers,SEACARE MANPOWER SERVICES PTE LTD,4170
FINVITETT16000002,Provision Of Auxiliary Police Services To Execute Warrants Of Arrest,Ministry of Finance - Vital,24/8/2016,Awarded to Suppliers,AETOS SECURITY MANAGEMENT PTE. LTD.,16802256
FINVITETT16000003,PROVISION OF RELOCATION MANAGEMENT SERVICES FOR TWO (2) YEARS WITH AN OPTION TO EXTEND UP TO ONE (1) YEAR,Ministry of Finance - Vital,13/10/2016,Awarded to Suppliers,ALLIED MOVING SERVICES (S) PTE. LTD.,1610.9
FINVITETT16000003,PROVISION OF RELOCATION MANAGEMENT SERVICES FOR TWO (2) YEARS WITH AN OPTION TO EXTEND UP TO ONE (1) YEAR,Ministry of Finance - Vital,13/10/2016,Awarded to Suppliers,Crown Worldwide Pte Ltd,2054.75
FINVITETT16000006,INVITATION TO TENDER (ITT) FOR THE SUPPLY OF ELECTRONICS AND ELECTRICAL APPLIANCES,Ministry of Finance - Vital,15/12/2016,Awarded to Suppliers,AV Media PTE LTD,92241.35
FINVITETT16000006,INVITATION TO TENDER (ITT) FOR THE SUPPLY OF ELECTRONICS AND ELECTRICAL APPLIANCES,Ministry of Finance - Vital,15/12/2016,Awarded to Suppliers,CATHAY PHOTO STORE (PRIVATE) LIMITED,330410.07
FINVITETT16000006,INVITATION TO TENDER (ITT) FOR THE SUPPLY OF ELECTRONICS AND ELECTRICAL APPLIANCES,Ministry of Finance - Vital,15/12/2016,Awarded to Suppliers,COURTS (SINGAPORE) PTE. LTD.,1644345.42
FINVITETT16000006,INVITATION TO TENDER (ITT) FOR THE SUPPLY OF ELECTRONICS AND ELECTRICAL APPLIANCES,Ministry of Finance - Vital,15/12/2016,Awarded to Suppliers,ETRONIN ELECTROMART,539997.2
FINVITETT16000006,INVITATION TO TENDER (ITT) FOR THE SUPPLY OF ELECTRONICS AND ELECTRICAL APPLIANCES,Ministry of Finance - Vital,15/12/2016,Awarded to Suppliers,LUCKY STORE,2567130.5
FINVITETT16000006,INVITATION TO TENDER (ITT) FOR THE SUPPLY OF ELECTRONICS AND ELECTRICAL APPLIANCES,Ministry of Finance - Vital,15/12/2016,Awarded to Suppliers,MAX PHOTO PTE LTD,330410.07
FINVITETT16000006,INVITATION TO TENDER (ITT) FOR THE SUPPLY OF ELECTRONICS AND ELECTRICAL APPLIANCES,Ministry of Finance - Vital,15/12/2016,Awarded to Suppliers,PARISILK ELECTRONICS & COMPUTERS PTE LTD,2567130.5
FINVITETT16000006,INVITATION TO TENDER (ITT) FOR THE SUPPLY OF ELECTRONICS AND ELECTRICAL APPLIANCES,Ministry of Finance - Vital,15/12/2016,Awarded to Suppliers,TAI SIN RADIO & ELECTRICAL PTE. LTD.,1012106.87
FOR000ETT15000034,Provision of Security Guarding Service for Chancery and Official Residences of the Singapore High Commission in Pretoria.,Ministry of Foreign Affairs,17/6/2016,Awarded to Suppliers,DDL Security Services (Pty) Ltd T/A 24/7 Security Services,395332.23
FOR000ETT15000066,Provision for Cleaning Services for the Embassy of the Republic of Singapore in Moscow,Ministry of Foreign Affairs,19/4/2016,Awarded to Suppliers,"LLC ""Kaskad-Holding""",101440
FOR000ETT15000068,Provision for Facility Management Services at the Embassy of the Republic of Singapore in Manila.,Ministry of Foreign Affairs,8/4/2016,Awarded to Suppliers,CENTURY PROPERTIES MANAGEMENT INC,329044.69
FOR000ETT15000072,Procurement of Facility Management Services for the Permanent Mission of the Republic of Singapore to the United Nations (New York),Ministry of Foreign Affairs,7/4/2016,Awarded to Suppliers,NEWMARK GRUBB KNIGHT FRANK,992923.46
FOR000ETT15000073,Supply and Installation of Artificial Turf with Drainage Cell on Roof of Buildings,Ministry of Foreign Affairs,8/4/2016,Awarded to Suppliers,ADWYN IMPEX PVT LTD,83383.3
FOR000ETT16000003,Provision of Security and Construction-related enhancements for Singapore High Commission in Canberra,Ministry of Foreign Affairs,19/4/2016,Awarded to Suppliers,Manteena Security (Aust) Pty Ltd,445620.77
FOR000ETT16000004,Provision of Managing Contractor for Maintenance Services for Riyadh Mission,Ministry of Foreign Affairs,8/4/2016,Awarded to Suppliers,ELECTRO SAUDI SERVICES LTD.,741417.47
FOR000ETT16000005,Provision of Managing Contractor for Security Services for Riyadh Mission,Ministry of Foreign Affairs,12/4/2016,Awarded to Suppliers,ELECTRO SAUDI SERVICES LTD.,1325693.09
FOR000ETT16000006,Provision of Security Services for the Embassy of the Republic of Singapore in Berlin,Ministry of Foreign Affairs,10/6/2016,Awarded to Suppliers,SICHERHEIT NORD GMBH & CO KG,1500679.73
FOR000ETT16000007,Provision of Security Guard Services for Singapore Embassy and Ambassador's Residence in Yangon,Ministry of Foreign Affairs,6/6/2016,Awarded to Suppliers,"Scipio Services Co., Ltd",582805.86
FOR000ETT16000008,"Provision of Security Guard Services for the Singapore Embassy in Bangkok, Thailand.",Ministry of Foreign Affairs,6/5/2016,Awarded to Suppliers,ISS Security Guarding Co. Ltd.,223102.46
FOR000ETT16000010,"Provision for Comprehensive Maintenance of Heating, Ventilation and Air-Conditioning (HVAC) System at the Consulate-General of the Republic of Singapore in Shanghai.",Ministry of Foreign Affairs,6/5/2016,Awarded to Suppliers,"Nylect Engineering (Shanghai) Co., Ltd",180578.4
FOR000ETT16000011,Provision for Comprehensive Maintenance of Security System at the Consulate-General of the Republic of Singapore in Shanghai,Ministry of Foreign Affairs,6/5/2016,Awarded to Suppliers,Shanghai Jiexin Integrated Intelligence System Ltd.,87555
FOR000ETT16000012,"Procurement of one(1) unit of duty free Saloon Car for the Singapore Embassy in Tokyo, Japan.",Ministry of Foreign Affairs,6/5/2016,Awarded to Suppliers,TOKYO TOYOPET CO LTD,83889.32
FOR000ETT16000013,"Provision of unarmed guard services at MFA HQ, for a period of two (2) years with an option to extend for a further two (2) one-year periods",Ministry of Foreign Affairs,2/6/2016,Awarded to Suppliers,CERTIS CISCO PROTECTION SERVICES PTE. LTD.,4917097
FOR000ETT16000015,"Provision of Replacement of Internal Finishes Including Wallpaper, Carpet, Roller Blind and Curtain at MFA Building.",Ministry of Foreign Affairs,5/7/2016,Awarded to Suppliers,CARPET IMAGE PTE LTD,18938
FOR000ETT16000015,"Provision of Replacement of Internal Finishes Including Wallpaper, Carpet, Roller Blind and Curtain at MFA Building.",Ministry of Foreign Affairs,5/7/2016,Awarded to Suppliers,VANGUARD INTERIORS PTE LTD,58918
FOR000ETT16000016,Provision for the Proposed Water Seepages rectification works at Basement 2 Offices at the Ministry of Foreign Affairs (MFA) Building.,Ministry of Foreign Affairs,29/6/2016,Awarded to Suppliers,BAUTEC PACIFIC PTE. LTD.,83600
