tender_no,tender_description,agency,award_date,tender_detail_status,supplier_name,awarded_amt
HDB000ETT16000043,"Construction Of Bus Shelter, Bus Bay And Signalised Pedestrian Crossing At Yishun Town",Housing and Development Board,8/7/2016,Awarded to Suppliers,SING TEC DEVELOPMENT PTE. LTD.,2053987
HDB000ETT16000044,Provision Of Conceptualisation And Event Management Of Smart Cool Ideas Challenge,Housing and Development Board,23/5/2016,Awarded to Suppliers,PADANG & CO PTE. LTD.,113180
HDB000ETT16000045,Term Contract For Security Guard Services For YS-One And Yishun Industrial Park A For A Period Of Eighteen (18) Months (Year 2016/2017),Housing and Development Board,14/4/2016,Awarded to Suppliers,COMINCO PTE LTD,441000
HDB000ETT16000046,"Term Contract For Security Guard Services At AMK Tech I, AMK Tech II, AMK Autopoint & AMK Techlink For A Period Of Eighteen (18) Months (Year 2016/2017)",Housing and Development Board,14/4/2016,Awarded to Suppliers,COMINCO PTE LTD,792000
HDB000ETT16000047,Accredited Checking Services For Addition And Alteration Works To Multi-Storey Carparks (Batch A),Housing and Development Board,9/6/2016,Awarded to No Suppliers,Unknown,0
HDB000ETT16000048,Construction of Heavy Vehicle Parking Lots and Ancillary Works at Marsiling Industrial Estate,Housing and Development Board,10/5/2016,Awarded to Suppliers,MEIZHUAN BUILDERS PTE LTD,751760
HDB000ETT16000049,Accredited Checking Services For Addition And Alteration Works To Multi-Storey Carparks (Batch B),Housing and Development Board,10/6/2016,Awarded to No Suppliers,Unknown,0
HDB000ETT16000050,Addition And Alteration Works To Multi-Storey Carparks (Batch A),Housing and Development Board,16/8/2016,Awarded to No Suppliers,Unknown,0
HDB000ETT16000051,Addition And Alteration Works To Multi-Storey Carparks (Batch B),Housing and Development Board,16/8/2016,Awarded to No Suppliers,Unknown,0
HDB000ETT16000052,Term Contract For Servicing Of Emergency Battery Operated Power Supply (EBOPS) Units For Lifts At Various HDB Industrial Estates For A Period Of Three (3) Years (YR 2016 To YR 2019),Housing and Development Board,20/5/2016,Awarded to Suppliers,CA M&E ENGINEERING PTE. LTD.,176592
HDB000ETT16000053,"Multi-Disciplinary (Civil & Structural Engineering, Mechanical & Electrical Engineering And Quantity Surveying) Consultancy Services For Various Civil Engineering Works",Housing and Development Board,22/7/2016,Awarded to Suppliers,TEP CONSULTANTS PTE LTD,0
HDB000ETT16000054,Multi-Disciplinary (Civil & Structural Engineering And Quantity Surveying) Supervision Consultancy Services For Public Housing At Punggol North Contracts 1 & 2 And Common Greens 1 & 2,Housing and Development Board,27/4/2016,Awarded to Suppliers,TEP CONSULTANTS PTE LTD,0
HDB000ETT16000055,Upgrading Of Toilets At Connection One,Housing and Development Board,7/4/2016,Awarded to Suppliers,FULL HOUSE BUILDING CONSTRUCTION PTE. LTD.,192474
HDB000ETT16000056,Instrumentation And Monitoring Works At Punggol North Contracts 1 & 2 And Common Greens 1 & 2,Housing and Development Board,20/4/2016,Awarded to Suppliers,RYOBI GEOTECHNIQUE INTERNATIONAL PTE. LTD.,226460
HDB000ETT16000057,Supply Of Ordinary Portland Cement To The HDB (Batch 29),Housing and Development Board,23/6/2016,Awarded to No Suppliers,Unknown,0
HDB000ETT16000058,Term Contract For Improvement Works To Multi Storey Car Parks (Zone 1),Housing and Development Board,29/7/2016,Awarded to Suppliers,SH INTEGRATED SERVICES PTE. LTD.,0
HDB000ETT16000059,Term Contract For Improvement Works To Multi Storey Car Parks (Zone 2),Housing and Development Board,29/7/2016,Awarded to Suppliers,ISO-TEAM CORPORATION PTE LTD,0
HDB000ETT16000060,Term Contract For Regular Cleaning Works At HDB Hub For A Period Of Twenty Four (24) Months,Housing and Development Board,6/5/2016,Awarded to Suppliers,LIAN CHENG CONTRACTING PTE LTD,4151736
HDB000ETT16000061,Supply Of Concreting Sand To The HDB (Batch 63),Housing and Development Board,7/6/2016,Awarded to No Suppliers,Unknown,0
HDB000ETT16000062,Supply And Delivery Of CADD Software,Housing and Development Board,28/4/2016,Awarded to Suppliers,Innocom Technologies Pte Ltd,120822
HDB000ETT16000063,"Supply, Fabrication, Delivery, Installation, Commissioning And Maintenance Of A HDB Town Model",Housing and Development Board,29/4/2016,Awarded to Suppliers,ANNESING PTE. LTD.,178000
HDB000ETT16000064,Preparation And Delivery Of Architectural Perspectives And 3D Animations/ Walk-Throughs/ Multi-Media Shows For A HDB Town Project,Housing and Development Board,29/4/2016,Awarded to Suppliers,Digital Mirage Pte Ltd,116100
HDB000ETT16000065,Construction Of Punggol Drive (Part 4) (Interim),Housing and Development Board,14/7/2016,Awarded to Suppliers,HUATIONG CONTRACTOR PTE LTD,2374318
HDB000ETT16000066,"Appointment Of Managing Agent For A Period Of 18.5 Months From 1 Jun 2016 To 15 Dec 2017 1) Kitchener Complex (Blocks 808 & 809, French Road) & Multi-Storey Carpark; 2) Bras Basah Complex (Block 231, Bain Street ) & Basement (1 Level) Carpark",Housing and Development Board,31/5/2016,Awarded to Suppliers,CPG Facilities Management Pte Ltd,2429738
HDB000ETT16000068,"Provision Of General Cleaning Services, Building Maintenance Services And General Waste Disposal Services At HDB Centre Of Building Research (CBR)",Housing and Development Board,16/5/2016,Awarded to Suppliers,YS YONG SERVICES PTE LTD,328800
HDB000ETT16000069,Improvement Works To Surface Car Parks (Batch 67),Housing and Development Board,25/7/2016,Awarded to Suppliers,MEIZHUAN BUILDERS PTE LTD,5696140
HDB000ETT16000071,Provision Of Internet Access Connections And Services (FY2015/T014),Housing and Development Board,18/8/2016,Awarded to Suppliers,LGA TELECOM PTE LTD,396002
HDB000ETT16000072,"(A) Earthworks And Slope Formation At Bukit Batok N4 (Phase 3); (B) Widening Of Bukit Batok West Avenue 2, Construction Of Bukit Batok West Avenue 5 (Extension) And Bukit Batok West Avenue 8 (Part 3); (C) Relocation Of Bus Bay And Bus Shelter At Bukit Batok Road",Housing and Development Board,16/9/2016,Awarded to Suppliers,HUATIONG CONTRACTOR PTE LTD,16790000
HDB000ETT16000073,"Multi-Disciplinary (Architectural, Civil & Structural Engineering, Mechanical & Electrical Engineering And Quantity Surveying) Consultancy Services For Public Housing At Punggol North Contract 8",Housing and Development Board,30/6/2016,Awarded to Suppliers,DESIGN LINK ARCHITECTS PTE. LTD.,0
HDB000ETT16000075,Supply Of Event Management Services At Joo Chiat Complex From May 2016 To Mar 2017,Housing and Development Board,3/5/2016,Awarded to Suppliers,ASIAWERKZ COMMUNICATIONS PTE. LTD.,90000
HDB000ETT16000076,"Part A: Building Works At Bukit Batok Neighbourhood 4 Contract 18 To 21 (Total: 1,962 Dwelling Units); Part B: Contingency Works",Housing and Development Board,29/7/2016,Awarded to Suppliers,"QINGJIAN INTERNATIONAL (SOUTH PACIFIC) GROUP DEVELOPMENT CO., PTE. LTD.",184979000
HDB000ETT16000077,Part A: Building Works At Sengkang Neighbourhood 3 Contract 28A And Common Green (Total: 921 Dwelling Units); Part B: Contingency Works,Housing and Development Board,29/7/2016,Awarded to Suppliers,LC&T BUILDER (1971) PTE. LTD.,96000000
HDB000ETT16000078,Provision Of Consultancy Services For Bidadari Green & Blue Master Plan And Park Project,Housing and Development Board,21/9/2016,Awarded to Suppliers,CPG CONSULTANTS PTE LTD,150000
HDB000ETT16000079,Provision Of Conceptualisation And Event Management Services For (A) The HDB Awards 2016 ; & (B) The HDB Peak Forum 2016,Housing and Development Board,30/6/2016,Awarded to Suppliers,CITYNEON EVENTS PTE. LTD.,189800
HDB000ETT16000080,Accredited Checking Services For Building Works At Bukit Panjang Neighbourhood 6 Contract 12,Housing and Development Board,27/4/2016,Awarded to Suppliers,CKM CONSULTANTS PTE LTD,15000
HDB000ETT16000081,Specialist Accredited Checking Services For Building Works At Bukit Panjang Neighbourhood 6 Contract 12,Housing and Development Board,27/4/2016,Awarded to Suppliers,GEOALLIANCE CONSULTANTS PTE. LTD.,7500
HDB000ETT16000082,"Provision Of Multi-Disciplinary Consultancy Services [Civil & Structural Engineering (Principal Consultant), Mechanical & Electrical Engineering And Quantity Surveying] For A Period Of 2 Years (Batch 10)",Housing and Development Board,2/9/2016,Awarded to Suppliers,CALIBRE CONSULTING (SINGAPORE) PTE. LTD.,0
HDB000ETT16000083,Inspection Of Fire Protection Services And Issuance Of Certificate Of Maintenance For Various HDB Industrial Estates For A Period Of Three (3) Years + Two (2) Optional Years (Year 2016/2019),Housing and Development Board,26/7/2016,Awarded to Suppliers,ENKON INTERNATIONAL CONSULTING ENGINEERS PTE LTD,87200
HDB000ETT16000084,Part A: Building Works At Hougang Neighbourhood 3 Contract 13 And Neighbourhood Centre (Total: 285 Dwelling Units); Part B: Contingency Works,Housing and Development Board,22/8/2016,Awarded to Suppliers,CKR CONTRACT SERVICES PTE. LTD.,73850000
HDB000ETT16000086,(A) Construction Of Roads At Punggol North (Phase 2A); (B) Construction Of Outlet Drain No. 3 At Punggol North,Housing and Development Board,6/12/2016,Awarded to Suppliers,SHUAN HUAT TRACTOR SERVICES PTE. LTD.,9547192
HDB000ETT16000087,Accredited Checking Services For Building Works At Ang Mo Kio Neighbourhood 2 Contract 31,Housing and Development Board,28/4/2016,Awarded to Suppliers,CKM CONSULTANTS PTE LTD,15375
HDB000ETT16000088,"Provision Of Multi-Disciplinary Consultancy Services [Civil & Structural Engineering (Principal Consultant), Mechanical & Electrical Engineering And Quantity Surveying] For A Period Of 2 Years (Batch 11)",Housing and Development Board,10/10/2016,Awarded to Suppliers,CALIBRE CONSULTING (SINGAPORE) PTE. LTD.,0
HDB000ETT16000089,"Part A: Building Works At Toa Payoh Bidadari Contract 6 & Contract 7 (Total: 1,594 Dwelling Units); Part B: Contingency Works",Housing and Development Board,19/8/2016,Awarded to Suppliers,CES ENGINEERING & CONSTRUCTION PTE. LTD.,191850000
HDB000ETT16000090,"To Design, Produce And Deliver Customised Items For HDB Shopping Centres 2016",Housing and Development Board,30/5/2016,Awarded to Suppliers,LTS GROUP PTE. LTD.,14700
HDB000ETT16000090,"To Design, Produce And Deliver Customised Items For HDB Shopping Centres 2016",Housing and Development Board,30/5/2016,Awarded to Suppliers,SIMPLICITY GIFTS,12740
HDB000ETT16000091,"Multi-Disciplinary (Architectural, Civil & Structural Engineering, Mechanical & Electrical Engineering, Quantity Surveying And Project Management) Consultancy Services For Public Housing At Bedok Town Centre Contract 8",Housing and Development Board,5/8/2016,Awarded to Suppliers,MKPL ARCHITECTS PTE. LTD.,0
HDB000ETT16000092,Proposed Earthworks At Woodlands N1C23-C25,Housing and Development Board,29/7/2016,Awarded to Suppliers,Lam Hwa Engineering & Trading Pte Ltd,2090000
HDB000ETT16000093,Accredited Checking Services For Building Works At Hougang Neighbourhood 9 Contract 21,Housing and Development Board,6/5/2016,Awarded to Suppliers,CKM CONSULTANTS PTE LTD,17500
HDB000ETT16000094,Improvement Works To Existing Column Stumps Of Water Tank Room Floor At The Main Roofs Of Residential Buildings (Batch 5),Housing and Development Board,4/7/2016,Awarded to Suppliers,USL ASIA PACIFIC PTE LTD,1945727
HDB000ETT16000096,Specialist Accredited Checking Services For Building Works At Bukit Panjang Neighbourhood 6 Contracts 13 & 14,Housing and Development Board,27/5/2016,Awarded to Suppliers,AGS CONSULTANTS PTE. LTD.,9000
HDB000ETT16000097,Accredited Checking Services For Building Works At Bukit Panjang Neighbourhood 6 Contracts 13 & 14,Housing and Development Board,27/5/2016,Awarded to Suppliers,CKM CONSULTANTS PTE LTD,27000
HDB000ETT16000098,Mechanical And Electrical Cyclical Improvement Works To Multi-Storey Car Parks (Batch 4),Housing and Development Board,12/10/2016,Awarded to Suppliers,Digo Corporation Pte Ltd,2176623
HDB000ETT16000099,Accredited Checking Services For Building Works At Bukit Panjang Neighbourhood 6 Contract 15,Housing and Development Board,26/5/2016,Awarded to Suppliers,CKM CONSULTANTS PTE LTD,14800
HDB000ETT16000100,Specialist Accredited Checking Services For Building Works At Bukit Panjang Neighbourhood 6 Contract 15,Housing and Development Board,26/5/2016,Awarded to Suppliers,GEOALLIANCE CONSULTANTS PTE. LTD.,6500
HDB000ETT16000101,To Provide Shuttle Bus Service (Autobay Route) For A Period Of Twenty Four Months (Year 2016/2018),Housing and Development Board,26/5/2016,Awarded to Suppliers,COMMUTE SOLUTIONS GROUP PTE. LTD.,139200
HDB000ETT16000102,"Supply, Delivery, Installation And Maintenance Of Lift Service Response System (LSRS) To Various HDB Industrial Estates",Housing and Development Board,3/8/2016,Awarded to No Suppliers,Unknown,0
HDB000ETT16000103,Provision Of Consultancy Services For Master Planning Of Industrial Land At Ang Mo Kio Industrial Park 2,Housing and Development Board,6/10/2016,Awarded to Suppliers,SURBANA JURONG CONSULTANTS PTE. LTD.,398000
HDB000ETT16000104,"Fire Reinstatement Works At Block 3019, Ubi Road 1",Housing and Development Board,8/6/2016,Awarded to Suppliers,YUAN MEI CHEN (S) PTE. LTD.,192980
HDB000ETT16000105,Term Contract For The Provision Of Testing Services For Semi-Destructive And Non-Destructive Tests,Housing and Development Board,8/6/2016,Awarded to Suppliers,Setsco Services Pte Ltd,631
HDB000ETT16000106,Supply Of Event Management Services For Promotion Event At 22 HDB Shopping Complexes,Housing and Development Board,25/5/2016,Awarded to Suppliers,ESN ASIA MANAGEMENT PTE. LTD.,342875
HDB000ETT16000108,Multi-Disciplinary (Civil & Structural Engineering And Quantity Surveying) Consultancy Services For Various Demolition Projects At Public Housing Estates (Batch 9),Housing and Development Board,12/8/2016,Awarded to Suppliers,CKMBT INTERNATIONAL PTE. LTD.,131500
HDB000ETT16000109,"Design, Production And Installation Of Festive Decorations For Hari Raya Puasa, National Day And Deepavali 2016 For HDB Shopping Complexes",Housing and Development Board,1/6/2016,Awarded to Suppliers,S-LITE EVENT SUPPORT PTE. LTD.,159975
HDB000ETT16000110,"Multi-Disciplinary (Architectural, Civil & Structural Engineering, Mechanical & Electrical Engineering And Quantity Surveying) Consultancy Services For Public Housing At Yishun Neighbourhood 4 Contract 20",Housing and Development Board,15/7/2016,Awarded to Suppliers,SURBANA JURONG CONSULTANTS PTE. LTD.,0
HDB000ETT16000111,"Multi-Disciplinary (Architectural, Civil & Structural Engineering, Mechanical & Electrical Engineering And Quantity Surveying) Consultancy Services For Public Housing At Guillemard Contract 1A",Housing and Development Board,15/7/2016,Awarded to Suppliers,ARCHITECTS 61 PRIVATE LIMITED,0
HDB000ETT16000112,"Multi-Disciplinary (Architectural, Civil & Structural Engineering, Mechanical & Electrical Engineering And Quantity Surveying) Consultancy Services For Public Housing At Geylang Contract 26A",Housing and Development Board,15/7/2016,Awarded to Suppliers,SURBANA JURONG CONSULTANTS PTE. LTD.,0
HDB000ETT16000113,"Multi-Disciplinary (Architectural, Civil & Structural Engineering, Mechanical & Electrical Engineering And Quantity Surveying) Consultancy Services For Public Housing At Woodlands Neighbourhood 1 Contract 25",Housing and Development Board,15/7/2016,Awarded to Suppliers,SURBANA JURONG CONSULTANTS PTE. LTD.,0
HDB000ETT16000114,"Multi-Disciplinary (Architectural, Civil & Structural Engineering, Mechanical & Electrical Engineering And Quantity Surveying) Consultancy Services For Public Housing At Woodlands Neighbourhood 7 Contract 33",Housing and Development Board,15/7/2016,Awarded to Suppliers,ARCHITECTS 61 PRIVATE LIMITED,0
HDB000ETT16000115,"Multi-Disciplinary (Architectural, Civil & Structural Engineering, Mechanical & Electrical Engineering And Quantity Surveying) Consultancy Services For Public Housing At Geylang Project A",Housing and Development Board,15/7/2016,Awarded to Suppliers,ARCHITECTS TEAM 3 PTE. LTD.,0
HDB000ETT16000116,Upgrading Works To Toilets At Marsiling Industrial Estate,Housing and Development Board,29/7/2016,Awarded to Suppliers,RDE CONSTRUCTION PTE LTD.,1000000
HDB000ETT16000117,"Supply, Delivery, Installation, Testing, Commissioning And Maintenance Of Environmental Sensors Network In A HDB Residential Estate",Housing and Development Board,17/11/2016,Awarded to Suppliers,BCT TECHNOLOGY PTE. LTD.,227120
HDB000ETT16000118,(A) Construction Of Canberra Crescent (Part 3) At Sembawang Town Neighbourhood 1; (B) Supply And Installation Of Road Directional Signs At Sembawang Town Neighbourhood 1,Housing and Development Board,21/9/2016,Awarded to Suppliers,SAMCO CIVIL ENGINEERING PTE. LTD.,2479020
HDB000ETT16000119,"Multi-Disciplinary (Architectural, Civil & Structural Engineering, Mechanical & Electrical Engineering And Quantity Surveying) Consultancy Services For Public Housing At Bedok Neighbourhood 2 Contract 11 With Community Club",Housing and Development Board,29/7/2016,Awarded to Suppliers,SURBANA JURONG CONSULTANTS PTE. LTD.,0
HDB000ETT16000120,Accredited Checking Services For Building Works At Bedok Neighbourhood 4 Contract 9,Housing and Development Board,30/5/2016,Awarded to Suppliers,PH CONSULTING PTE. LTD.,16000
HDB000ETT16000121,Addition And Alteration Works To Car Parks (C1),Housing and Development Board,25/8/2016,Awarded to Suppliers,MEIDA CONSTRUCTION PTE. LTD.,2505000
HDB000ETT16000122,Addition & Alteration Works At HDB Offices,Housing and Development Board,16/6/2016,Awarded to Suppliers,INVOGUE BIZ PTE. LTD.,108040
HDB000ETT16000125,"Professional Services To Develop, Implement, Migrate And Maintain The HDB Digital Document Repository (HDB DDR) (FY2015/T012)",Housing and Development Board,5/9/2016,Awarded to Suppliers,FPT ASIA PACIFIC PTE. LTD.,408019
HDB000ETT16000126,"Conceptualisation, Design, Fabrication And Installation Of Exhibition For 2016 Peak Forum Public Exhibition",Housing and Development Board,22/6/2016,Awarded to Suppliers,MILTON EXHIBITS (SINGAPORE) PTE. LTD.,168806.5
HDB000ETT16000127,Mechanical And Electrical Cyclical Improvement Works To Multi-Storey Car Parks (Batch 2),Housing and Development Board,12/10/2016,Awarded to Suppliers,PROPELL INTEGRATED PTE LTD,4056000
HDB000ETT16000128,A) Design & Build Of Upgrading Projects For G24A; B) Contingency Works,Housing and Development Board,29/12/2016,Awarded to Suppliers,KIENTA ENGINEERING CONSTRUCTION PTE. LTD.,22500000
HDB000ETT16000129,Term Contract For Servicing And Maintenance Of Fire Protection System And Standby Generator Sets At HDB Shopping Complexes For 39 Months (Contract 1),Housing and Development Board,16/6/2016,Awarded to Suppliers,C&W SERVICES OPERATIONS PTE. LTD.,64293
HDB000ETT16000130,"Term Contract For Minor Building, Sanitary And Plumbing Works At Various HDB Industrial Estates For Two Years From 2016 To 2018 (West-2)",Housing and Development Board,3/8/2016,Awarded to Suppliers,PIKASA BUILDERS PTE. LTD.,0
HDB000ETT16000133,A) Design & Build Of Upgrading Projects For G24E; B) Contingency Works,Housing and Development Board,22/12/2016,Awarded to Suppliers,CHAN RONG FEN BUILDING CONSTRUCTION PTE LTD,27500000
HDB000ETT16000134,Supply Of Management Services For Event And Publicity Materials For Lucky Draw From Sep 16 To Dec 16 For 21 HDB Shopping Centres,Housing and Development Board,28/6/2016,Awarded to Suppliers,RADIUS EXPERIENTIAL INTERNATIONAL PTE. LTD.,83959
HDB000ETT16000136,Multi-Disciplinary (Civil & Structural Engineering And Quantity Surveying) Consultancy Services For Demolition Project At Public Housing Estate (Batch 10),Housing and Development Board,10/8/2016,Awarded to Suppliers,CKMBT INTERNATIONAL PTE. LTD.,74000
HDB000ETT16000137,Comprehensive Maintenance Of Microcomputers And Peripherals (FY2015/T017),Housing and Development Board,29/7/2016,Awarded to Suppliers,ITECH VISION PTE LTD,13675.6
HDB000ETT16000139,Improvement Works To Surface Car Parks (Batch 69),Housing and Development Board,18/10/2016,Awarded to Suppliers,SING TEC DEVELOPMENT PTE. LTD.,13177000
HDB000ETT16000141,Provision Of Heartland Ambassador Training Programme,Housing and Development Board,3/8/2016,Awarded to Suppliers,VIVARCH ENRICHMENT PTE. LTD.,4323.67
HDB000ETT16000142,Improvement Works To Multi-Storey Car Parks And Standalone Electrical Sub-Stations (Batch 50),Housing and Development Board,13/10/2016,Awarded to Suppliers,CKR PAINTS & COATING SPECIALIST PTE. LTD.,5435000
HDB000ETT16000143,Addition And Alteration Works At HDB Hub Atrium Level 2,Housing and Development Board,30/8/2016,Awarded to Suppliers,QXY RESOURCES PTE. LTD.,2566000
HDB000ETT16000144,Drains Repair & Improvements Works At Defu Industrial Estate,Housing and Development Board,5/9/2016,Awarded to Suppliers,JUPITER BUILDER PTE. LTD.,4926000
HDB000ETT16000145,Repairs And Redecoration Works At KB-1,Housing and Development Board,5/9/2016,Awarded to Suppliers,QXY RESOURCES PTE. LTD.,1368000
HDB000ETT16000146,Term Contract For Cleaning And Conservancy Works (Contract 1),Housing and Development Board,20/9/2016,Awarded to Suppliers,TEE ENVIRONMENTAL PTE. LTD.,7222620
HDB000ETT16000147,Term Contract For Cleaning And Conservancy Works (Contract 2),Housing and Development Board,20/9/2016,Awarded to Suppliers,ATL MAINTENANCE PTE. LTD.,6473916
HDB000ETT16000148,Term Contract For Cleaning And Conservancy Works (Contract 3),Housing and Development Board,20/9/2016,Awarded to Suppliers,THENG LIANG LEE SERVICES PTE LTD,7874720
HDB000ETT16000151,"Provision Of Design Consultancy, Content Development And Fit-Out Services Of The Punggol Visitor Centre",Housing and Development Board,10/8/2016,Awarded to Suppliers,Kingsmen Exhibits Pte Ltd,778000
HDB000ETT16000152,"Design, Build, Operate & Maintenance Of A Pneumatic Waste Conveyance System (PWCS) At Bukit Batok (N4 C18-C21)",Housing and Development Board,26/10/2016,Awarded to Suppliers,STREAM ENVIRONMENT (S) PTE. LTD.,2238880
HDB000ETT16000154,Accredited Checking Services For Building Works At Sembawang Neighbourhood 1 Contract 1,Housing and Development Board,8/7/2016,Awarded to Suppliers,PH CONSULTING PTE. LTD.,14800
HDB000ETT16000155,Improvement Works To Surface Car Parks (Batch 68),Housing and Development Board,14/10/2016,Awarded to Suppliers,SING TEC DEVELOPMENT PTE. LTD.,8250000
HDB000ETT16000157,"Supply, Delivery, Installation, Testing, Commissioning And Maintenance Of E-Polling System For Housing Management Group (Year 2016)",Housing and Development Board,21/9/2016,Awarded to No Suppliers,Unknown,0
HDB000ETT16000160,"Supply, Delivery, Propagation And Maintenance Of Freshwater-Tolerant Mangroves And Freshwater Swamp Species Along Punggol Waterway (2)",Housing and Development Board,7/10/2016,Awarded to Suppliers,HOCKLIM ENGINEERING PTE. LTD.,266150
HDB000ETT16000162,Fire Insurance Coverage For HDB Properties For The Period 1 October 2016 To 31 March 2020,Housing and Development Board,5/9/2016,Awarded to Suppliers,AVA INSURANCE BROKERS PTE. LTD.,2555000
HDB000ETT16000163,"Term Contract For Provision Of Services For Laboratory Testing, Operation And Maintenance At HDB Engineering Materials Laboratory (Batch 4)",Housing and Development Board,25/8/2016,Awarded to Suppliers,BNL SERVICES PTE LTD,20500.36
HDB000ETT16000164,Supply Of Java Programming Services (FY2016/T001),Housing and Development Board,20/9/2016,Awarded to Suppliers,NSEARCH GLOBAL PTE. LTD.,462
HDB000ETT16000164,Supply Of Java Programming Services (FY2016/T001),Housing and Development Board,20/9/2016,Awarded to Suppliers,WDC CONSULTING SINGAPORE PTE. LTD.,540
HDB000ETT16000166,Appointment Of Managing Agent For Punggol Town Plaza,Housing and Development Board,30/9/2016,Awarded to Suppliers,KNIGHT FRANK PROPERTY ASSET MANAGEMENT PTE. LTD.,1186411.4
HDB000ETT16000167,(A) Construction Of Trunk Sewer Along Sengkang West Road; (B) Earthwork At Sengkang East Drive; (C) Construction Of Outlet Drain At Sengkang East Drive,Housing and Development Board,14/11/2016,Awarded to Suppliers,PROGRESSIVE BUILDERS PRIVATE LIMITED,7700000
HDB000ETT16000169,Accredited Checking Services For The Checking Of Structural Design For Construction Of Pedestrian Overhead Bridge Along Sengkang East Way,Housing and Development Board,24/8/2016,Awarded to No Suppliers,Unknown,0
HDB000ETT16000171,Formal Safety Assessment Study At Changi East,Housing and Development Board,9/11/2016,Awarded to Suppliers,BMT SINGAPORE PTE. LTD.,173550
HDB000ETT16000172,Term Contract For The Repair Of Ceiling Leak In HDB Flats For A Period Of Eighteen (18) Months - Batch 18,Housing and Development Board,24/8/2016,Awarded to Suppliers,GOH & FOONG CONTRACTORS PTE LTD,0
HDB000ETT16000173,Term Contract For The Repair Of Ceiling Leak In HDB Flats For A Period Of Eighteen (18) Months - Batch 19,Housing and Development Board,24/8/2016,Awarded to Suppliers,JI-HON DEVELOPMENT PTE LTD,0
HDB000ETT16000174,Term Contract For The Repair Of Ceiling Leak In HDB Flats For A Period Of Eighteen (18) Months - Batch 20,Housing and Development Board,24/8/2016,Awarded to Suppliers,SUCCESS FOREVER CONSTRUCTION & MAINTENANCE PTE LTD,0
HDB000ETT16000175,Term Contract For The Repair Of Ceiling Leak In HDB Flats For A Period Of Eighteen (18) Months - Batch 21,Housing and Development Board,24/8/2016,Awarded to Suppliers,ESPIRIT BUILDING & ENGINEERING PTE. LTD.,0
HDB000ETT16000179,A) Design & Build Of Upgrading Projects For G25J; B) Contingency Works,Housing and Development Board,28/12/2016,Awarded to Suppliers,KHIAN HENG CONSTRUCTION (PRIVATE) LIMITED,17590000
HDB000ETT16000180,Supply Of Computer Disaster Recovery Services For A Period Of Five (5) Years,Housing and Development Board,30/11/2016,Awarded to Suppliers,IBM SINGAPORE PTE LTD,258814.29
HDB000ETT16000181,Construction Of Trunk Sewer Along Anchorvale Lane,Housing and Development Board,14/10/2016,Awarded to Suppliers,PRESSCRETE ENGINEERING PTE LTD,1230000
HDB000ETT16000182,A) Design & Build Of Upgrading Projects For G25G; B) Contingency Works,Housing and Development Board,14/12/2016,Awarded to Suppliers,PRECISE DEVELOPMENT PTE. LTD.,15118000
